TIGGER: Scalable Generative Modelling for Temporal Interaction Graphs,AAAI,17,"Leskovec, J., Leskovec, J., & Faloutsos, C.",3.0,"Graphs over time: densification laws, shrinking diameters and possible explanations",2005.0,Proceedings of the eleventh ACM SIGKDD international conference on Knowledge discovery in data mining,788b6f36a2b7cab86a5a29000e8b7cde25b85e73,"Graphs over time: densification laws, shrinking diameters and possible explanations",Knowledge Discovery and Data Mining,Knowledge Discovery and Data Mining,2005.0,"J. Leskovec, J. Kleinberg, C. Faloutsos",3.0,2532.0,205.0,31.0,False,"['Mathematics', 'Computer Science']","[{'category': 'Mathematics', 'source': 'external'}, {'category': 'Computer Science', 'source': 'external'}, {'category': 'Computer Science', 'source': 's2-fos-model'}, {'category': 'Mathematics', 'source': 's2-fos-model'}, {'category': 'Sociology', 'source': 's2-fos-model'}]",0.0,0.0,0.0,100.0,100.0,1.0,TIGGER: Scalable Generative Modelling for Temporal Interaction Graphs17,83.0,83.0,Proceedings of the eleventh ACM SIGKDD international conference on Knowledge discovery in data mining,Knowledge Discovery and Data Mining,vanilla_1,1,TIGGER: Scalable Generative Modelling for Temporal Interaction Graphs17vanilla_1
Fast Nonlinear Vector Quantile Regression,ICLR,3,"Cuturi, M., & Peyré, G.",2.0,A Smoothed Dual Approach for Variational Wasserstein Problems,2015.0,Siam Journal on Imaging Sciences,1c25d9f677192bfafd3c8722827e452518bf40ed,A Smoothed Dual Approach for Variational Wasserstein Problems,SIAM Journal of Imaging Sciences,SIAM Journal of Imaging Sciences,2015.0,"Marco Cuturi, G. Peyré",2.0,167.0,19.0,52.0,True,"['Computer Science', 'Mathematics']","[{'category': 'Computer Science', 'source': 'external'}, {'category': 'Mathematics', 'source': 'external'}, {'category': 'Mathematics', 'source': 's2-fos-model'}, {'category': 'Computer Science', 'source': 's2-fos-model'}]",0.0,0.0,0.0,100.0,93.0,1.0,Fast Nonlinear Vector Quantile Regression3,61.0,61.0,Siam Journal on Imaging Sciences,SIAM Journal of Imaging Sciences,vanilla_1,1,Fast Nonlinear Vector Quantile Regression3vanilla_1
Interpretability with full complexity by constraining feature information,ICLR,25,"Achille, A., & Soatto, S.",2.0,Emergence of invariance and disentanglement in deep representations,2018.0,The Journal of Machine Learning Research,4d7574c0c4aca70e5811a8e33906f0106d6b76e6,Emergence of Invariance and Disentanglement in Deep Representations,Information Theory and Applications Workshop,Information Theory and Applications Workshop,2017.0,"A. Achille, Stefano Soatto",2.0,407.0,40.0,46.0,True,"['Computer Science', 'Mathematics']","[{'category': 'Computer Science', 'source': 'external'}, {'category': 'Mathematics', 'source': 'external'}, {'category': 'Computer Science', 'source': 's2-fos-model'}]",0.0,0.0,0.0,100.0,94.0,1.0,Interpretability with full complexity by constraining feature information25,67.0,67.0,JMLR,Information Theory and Applications Workshop,vanilla_1,0,Interpretability with full complexity by constraining feature information25vanilla_1
Self-Supervised Contrastive Pre-Training For Time Series via Time-Frequency Consistency,NeurIPS,6,"Hawryszkiewycz, A., & Hamilton, J. D.",2.0,Factorization of predictive densities for large scale macroeconomic forecasting,2020.0,International Journal of Forecasting,,,,,,,,,,,,,,0.0,0.0,1.0,,,0.0,Self-Supervised Contrastive Pre-Training For Time Series via Time-Frequency Consistency6,79.0,,International Journal of Forecasting,,vanilla_1,0,Self-Supervised Contrastive Pre-Training For Time Series via Time-Frequency Consistency6vanilla_1
Concentration of Data Encoding in Parameterized Quantum Circuits,NeurIPS,11,"M. Schuld, et al.",et al.,Circuit-centric quantum classifiers,2020.0,Physical Review A,804f822f9a6db8f559801f1c618b7d6c766741b4,Circuit-centric quantum classifiers,Physical Review A,,2018.0,"M. Schuld, A. Bocharov, K. Svore, N. Wiebe",4.0,502.0,49.0,52.0,True,['Physics'],"[{'category': 'Physics', 'source': 'external'}, {'category': 'Physics', 'source': 's2-fos-model'}, {'category': 'Computer Science', 'source': 's2-fos-model'}]",1.0,1.0,0.0,100.0,100.0,1.0,Concentration of Data Encoding in Parameterized Quantum Circuits11,35.0,35.0,Physical Review A,Physical Review A,vanilla_1,1,Concentration of Data Encoding in Parameterized Quantum Circuits11vanilla_1
Artificial Neuronal Ensembles with Learned Context Dependent Gating,ICLR,6,"Goodfellow, I. J., Mirza, M., Xiao, D., Courville, A., Bengio, Y.",5.0,An empirical investigation of catastrophic forgeting in gradient-based neural networks,2013.0,arXiv preprint,0407b605b8f55db72e2545586bfe8e946b691b70,An Empirical Investigation of Catastrophic Forgeting in Gradient-Based Neural Networks,International Conference on Learning Representations,International Conference on Learning Representations,2013.0,"I. Goodfellow, Mehdi Mirza, Xia Da, Aaron C. Courville, Yoshua Bengio",5.0,1065.0,81.0,19.0,False,"['Computer Science', 'Mathematics']","[{'category': 'Computer Science', 'source': 'external'}, {'category': 'Mathematics', 'source': 'external'}, {'category': 'Computer Science', 'source': 's2-fos-model'}]",1.0,1.0,0.0,100.0,83.0,1.0,Artificial Neuronal Ensembles with Learned Context Dependent Gating6,86.0,86.0,arxiv,ICLR,vanilla_1,1,Artificial Neuronal Ensembles with Learned Context Dependent Gating6vanilla_1
